{
  "$schema": "./theme.schema.json",
  "schemaVersion": 1,
  "id": "pixelody.studio",
  "name": "Pixelody Studio",
  "author": "Pixelody",
  "description": "The default layout, with a dark background and warm hardware details.",
  "palette": { "builtIn": "gold" },
  "assets": { "backgroundTexture": null, "heroOverlay": null, "panelFrame": null, "iconSet": "../assets/icons/" },
  "hud": { "layout": "studio", "controls": "pixel", "corners": "pixel-cut" },
  "typography": { "profile": "pixel", "font": "../assets/fonts/GeistPixel-Circle.woff2" },
  "motion": { "profile": "signal", "intensity": "calm" }
}
