{
  "$schema": "./theme.schema.json",
  "schemaVersion": 1,
  "id": "pixelody.obsidian-glass",
  "name": "Obsidian Glass",
  "author": "Pixelody",
  "description": "Large artwork and silver controls on dark glass.",
  "palette": { "primary": "#f7f7f2", "secondary": "#9fdcff", "base": "#020306" },
  "assets": { "backgroundTexture": null, "heroOverlay": null, "panelFrame": null, "iconSet": null },
  "hud": { "layout": "cinematic", "controls": "minimal", "corners": "soft" },
  "typography": { "profile": "display", "font": "../assets/themes/cosmic-cinema/SpaceGrotesk-Variable.ttf" },
  "motion": { "profile": "drift", "intensity": "calm" }
}
