{
  "$schema": "./theme.schema.json",
  "schemaVersion": 1,
  "id": "pixelody.ascii-social",
  "name": "ASCII Social",
  "author": "Pixelody",
  "description": "Charcoal panels, amber controls, cyan labels, and character art.",
  "palette": { "primary": "#d6b45d", "secondary": "#79d8cf", "base": "#07090c" },
  "assets": {
    "backgroundTexture": "../assets/themes/ascii-social/emoticon-wall.svg",
    "heroOverlay": "../assets/themes/ascii-social/emoticon-wall.svg",
    "panelFrame": null,
    "iconSet": null
  },
  "hud": { "layout": "arcade", "controls": "ornamental", "corners": "framed" },
  "typography": { "profile": "display", "font": null },
  "motion": { "profile": "pulse", "intensity": "expressive" }
}
