{
  "$schema": "./theme.schema.json",
  "schemaVersion": 1,
  "id": "pixelody.frosted-void",
  "name": "Frosted Void",
  "author": "Pixelody",
  "description": "Black acrylic, frosted controls, and bright edges.",
  "palette": { "primary": "#f4f4ef", "secondary": "#a9c8ff", "base": "#000000" },
  "assets": { "backgroundTexture": null, "heroOverlay": "../assets/themes/frosted-void/spectral-bubbles.svg", "panelFrame": null, "iconSet": null },
  "hud": { "layout": "cinematic", "controls": "minimal", "corners": "square" },
  "typography": { "profile": "display", "font": "../assets/themes/cosmic-cinema/SpaceGrotesk-Variable.ttf" },
  "motion": { "profile": "pulse", "intensity": "calm" }
}
