{
  "$schema": "./theme.schema.json",
  "schemaVersion": 1,
  "id": "pixelody.dev-lab",
  "name": "Dev Lab",
  "author": "Pixelody",
  "description": "A workbench for trying controls, diagnostics, and layout ideas.",
  "palette": { "builtIn": "dev-lab" },
  "assets": { "backgroundTexture": null, "heroOverlay": null, "panelFrame": null, "iconSet": "../assets/icons/" },
  "hud": { "layout": "studio", "controls": "pixel", "corners": "pixel-cut" },
  "typography": { "profile": "pixel", "font": "../assets/fonts/GeistPixel-Circle.woff2" },
  "motion": { "profile": "signal", "intensity": "calm" }
}
