{
  "$schema": "./theme.schema.json",
  "schemaVersion": 1,
  "id": "pixelody.meme-machine",
  "name": "Meme Machine",
  "author": "Pixelody",
  "description": "Chatroom panels, reaction details, and purple and green controls.",
  "palette": { "primary": "#5865f2", "secondary": "#fee75c", "base": "#111214" },
  "assets": { "backgroundTexture": "../assets/themes/meme-machine/chaos-cards.svg", "heroOverlay": "../assets/themes/meme-machine/crying.svg", "panelFrame": null, "iconSet": "../assets/themes/meme-machine/reaction-deck.svg" },
  "hud": { "layout": "arcade", "controls": "minimal", "corners": "soft" },
  "typography": { "profile": "display", "font": "../assets/themes/cosmic-cinema/SpaceGrotesk-Variable.ttf" },
  "motion": { "profile": "pulse", "intensity": "expressive" }
}
