{
  "$schema": "./theme.schema.json", "schemaVersion": 1, "id": "pixelody.creator-layer", "name": "Creator Layer", "author": "Pixelody",
  "description": "Channel-style navigation with purple controls and green playback details.",
  "palette": { "primary": "#5865f2", "secondary": "#23a55a", "base": "#1e1f22" },
  "assets": { "backgroundTexture": null, "heroOverlay": null, "panelFrame": null, "iconSet": null },
  "hud": { "layout": "compact", "controls": "minimal", "corners": "soft" },
  "typography": { "profile": "technical", "font": null },
  "motion": { "profile": "pulse", "intensity": "calm" }
}
