{
  "$schema": "./theme.schema.json",
  "schemaVersion": 1,
  "id": "creator.theme-name",
  "name": "Theme Name",
  "author": "Creator Name",
  "description": "A short description of the theme.",
  "palette": {
    "primary": "#d8b66a",
    "secondary": "#65d6a1",
    "base": "#050607"
  },
  "assets": {
    "backgroundTexture": null,
    "heroOverlay": null,
    "panelFrame": null,
    "iconSet": null
  },
  "hud": {
    "layout": "studio",
    "controls": "pixel",
    "corners": "pixel-cut"
  },
  "typography": {
    "profile": "pixel",
    "font": null
  },
  "motion": {
    "profile": "signal",
    "intensity": "calm"
  }
}
